{
  "alerts": [
    {
      "ack": {
        "message_id": "h1",
        "person_id": null
      },
      "caption": "@here Dinner is <b>ready</b>!",
      "from_label": "Message from Anna",
      "id": "h1",
      "iso": "2026-10-12T14:29:00+02:00",
      "key": "h1:here",
      "label": "Message for everyone",
      "name": "Anna",
      "person": "u-anna",
      "say": "Anna says: @here Dinner is <b>ready</b>!",
      "text": "@here Dinner is <b>ready</b>!",
      "when": "3 min ago"
    }
  ],
  "api_version": 1,
  "clock": {
    "date": "Monday, October 12",
    "day": "2026-10-12",
    "iso": "2026-10-12T14:32:00+02:00",
    "time": "14:32",
    "tz": "Europe/Berlin",
    "unix": 1791808320,
    "utc_offset_minutes": 120
  },
  "dir": "ltr",
  "household": "Home",
  "is_night": false,
  "locale": "en",
  "map": {
    "attribution": "© OpenStreetMap contributors",
    "bubbles": [
      {
        "age": null,
        "away": false,
        "caption": "🏠 Home",
        "key": "zone:hz_home",
        "label": "Mia, Pascal · 🏠 Home",
        "lat": 52.52,
        "lon": 13.405,
        "members": [
          "u-mia",
          "u-pascal"
        ],
        "more": 0,
        "stale": false,
        "zone": "hz_home"
      },
      {
        "age": null,
        "away": false,
        "caption": "🏫 School",
        "key": "zone:hz_school",
        "label": "Leo · 🏫 School",
        "lat": 52.5262,
        "lon": 13.4103,
        "members": [
          "u-leo"
        ],
        "more": 0,
        "stale": false,
        "zone": "hz_school"
      },
      {
        "age": null,
        "away": true,
        "caption": "🚗 Away",
        "key": "person:u-anna",
        "label": "Anna · 🚗 Away",
        "lat": 52.5232,
        "lon": 13.3961,
        "members": [
          "u-anna"
        ],
        "more": 0,
        "stale": false,
        "zone": null
      }
    ],
    "image": {
      "etag": "\"054b8fa50fdea399bc76398c501de86d\"",
      "height": 560,
      "url": "/api/display/v1/map.png",
      "width": 748
    },
    "label": "Map: Mia and Pascal at Home, Leo at School, Anna away",
    "pins": [
      {
        "color": "#84cc16",
        "icon": {
          "code": "1f3e0",
          "text": "🏠"
        },
        "id": "hz_home",
        "is_home": true,
        "lat": 52.52,
        "lon": 13.405,
        "name": "Home",
        "occupied": true,
        "radius_m": 100
      },
      {
        "color": "#1f8a9e",
        "icon": {
          "code": "1f3eb",
          "text": "🏫"
        },
        "id": "hz_school",
        "is_home": false,
        "lat": 52.5262,
        "lon": 13.4103,
        "name": "School",
        "occupied": true,
        "radius_m": 80
      },
      {
        "color": "#6366f1",
        "icon": {
          "code": null,
          "text": "W"
        },
        "id": "hz_work",
        "is_home": false,
        "lat": 52.5121,
        "lon": 13.4199,
        "name": "Work",
        "occupied": false,
        "radius_m": 120
      }
    ],
    "spots": [
      {
        "age_label": "updated 5 min ago",
        "icon": {
          "code": "1f3e0",
          "text": "🏠"
        },
        "iso": "2026-10-12T14:27:00+02:00",
        "lat": null,
        "lon": null,
        "name": "Mia",
        "person": "u-mia",
        "place": "Home",
        "stale": false,
        "when": "5 min ago",
        "zone": "hz_home"
      },
      {
        "age_label": "updated 2 min ago",
        "icon": {
          "code": "1f3e0",
          "text": "🏠"
        },
        "iso": "2026-10-12T14:30:00+02:00",
        "lat": null,
        "lon": null,
        "name": "Pascal",
        "person": "u-pascal",
        "place": "Home",
        "stale": false,
        "when": "2 min ago",
        "zone": "hz_home"
      },
      {
        "age_label": "updated 8 min ago",
        "icon": {
          "code": "1f3eb",
          "text": "🏫"
        },
        "iso": "2026-10-12T14:24:00+02:00",
        "lat": null,
        "lon": null,
        "name": "Leo",
        "person": "u-leo",
        "place": "School",
        "stale": false,
        "when": "8 min ago",
        "zone": "hz_school"
      },
      {
        "age_label": "updated 5 min ago",
        "icon": {
          "code": "1f697",
          "text": "🚗"
        },
        "iso": "2026-10-12T14:27:00+02:00",
        "lat": 52.5232,
        "lon": 13.3961,
        "name": "Anna",
        "person": "u-anna",
        "place": "Away",
        "stale": false,
        "when": "5 min ago",
        "zone": null
      }
    ],
    "title": "Who's where"
  },
  "night": null,
  "people": [
    {
      "avatar": null,
      "badge": 0,
      "badge_label": null,
      "color": "#357bbb",
      "id": "u-pascal",
      "initials": "P",
      "ink": "#000000",
      "name": "Pascal",
      "picture_hash": null,
      "picture_view": false,
      "where": {
        "icon": {
          "code": "1f3e0",
          "text": "🏠"
        },
        "label": "Home"
      }
    },
    {
      "avatar": "/api/display/v1/avatar/u-anna?v=pic1",
      "badge": 0,
      "badge_label": null,
      "color": "#c44d72",
      "id": "u-anna",
      "initials": "A",
      "ink": "#000000",
      "name": "Anna",
      "picture_hash": "pic1",
      "picture_view": false,
      "where": {
        "icon": {
          "code": "1f697",
          "text": "🚗"
        },
        "label": "Away"
      }
    },
    {
      "avatar": null,
      "badge": 1,
      "badge_label": "New message for Mia",
      "color": "#3f7d57",
      "id": "u-mia",
      "initials": "M",
      "ink": "#ffffff",
      "name": "Mia",
      "picture_hash": null,
      "picture_view": false,
      "where": {
        "icon": {
          "code": "1f3e0",
          "text": "🏠"
        },
        "label": "Home"
      }
    },
    {
      "avatar": null,
      "badge": 1,
      "badge_label": "New message for Leo",
      "color": "#ad780c",
      "id": "u-leo",
      "initials": "L",
      "ink": "#000000",
      "name": "Leo",
      "picture_hash": null,
      "picture_view": true,
      "where": {
        "icon": {
          "code": "1f4cd",
          "text": "📍"
        },
        "label": "School"
      }
    }
  ],
  "rail": {
    "current": null,
    "many": false,
    "shown": true
  },
  "settings": {
    "idle_return_minutes": 3,
    "keep_screen_on": true,
    "mention_sound": true,
    "night_end": "06:00",
    "night_start": "22:00",
    "pin_set": false
  },
  "tab": "map",
  "tabs": [
    {
      "badge": 0,
      "badge_label": null,
      "current": false,
      "key": "overview",
      "label": "Overview",
      "path": "/api/display/v1/home"
    },
    {
      "badge": 1,
      "badge_label": "1 new",
      "current": false,
      "key": "messages",
      "label": "Messages",
      "path": "/api/display/v1/messages"
    },
    {
      "badge": 0,
      "badge_label": null,
      "current": false,
      "key": "notes",
      "label": "Notes",
      "path": "/api/display/v1/notes"
    },
    {
      "badge": 0,
      "badge_label": null,
      "current": true,
      "key": "map",
      "label": "Map",
      "path": "/api/display/v1/map"
    }
  ],
  "view": "map",
  "view_key": "20c6063e3c57ee58"
}
